{
  "mandate": "acme-webapp-engagement",
  "version": "SOW-2026-114",
  "workspace": "secops-agents",
  "on_violation": "block",
  "bindings": [
    {
      "tool": "run_shell",
      "capability": "net.scan",
      "fields": {
        "target": "target",
        "technique": "technique"
      },
      "capability_map": {
        "technique": {
          "denial_of_service": "denial_of_service",
          "phish": "phishing"
        }
      }
    },
    {
      "tool": "http_request",
      "capability": "web.probe",
      "fields": {
        "target": "host"
      }
    },
    {
      "tool": "write_report",
      "capability": "evidence.write"
    }
  ],
  "scope": {
    "allow": [
      "10.20.0.0/16",
      "app.acme.example"
    ],
    "deny": [
      "10.20.0.1"
    ]
  },
  "capabilities": {
    "allow": [
      "net.scan",
      "web.probe",
      "evidence.write"
    ],
    "deny": [
      "denial_of_service",
      "phishing",
      "exploit.third_party"
    ]
  },
  "limits": [
    {
      "id": "scan-rate",
      "metric": "count",
      "window": "per_minute",
      "max": 30
    }
  ],
  "windows": [
    {
      "id": "maintenance",
      "timezone": "America/New_York",
      "days": [
        "tue",
        "wed",
        "thu"
      ],
      "from": "02:00",
      "to": "06:00"
    }
  ],
  "irreversible": [
    {
      "id": "destructive",
      "capability": "net.scan",
      "when": {
        "technique": [
          "drop",
          "encrypt",
          "wipe"
        ]
      }
    }
  ]
}
